{
  "contract": "spartina-device-render-catalog",
  "contract_version": 1,
  "devices": {
    "iphone-17": {
      "device_id": "iphone-17",
      "templates": [
        {
          "case_type": "hard",
          "production_publishable": false,
          "provenance": {
            "supplier_geometry": "none — not a production SKU template"
          },
          "renderable": true,
          "template_id": "iphone-17__hard__rear",
          "template_status": "prototype",
          "view": "rear"
        }
      ]
    },
    "iphone-17e": {
      "device_id": "iphone-17e",
      "templates": [
        {
          "case_type": "hard",
          "production_publishable": false,
          "provenance": {
            "supplier_geometry": "none — not a production SKU template"
          },
          "renderable": true,
          "template_id": "iphone-17e__hard__rear",
          "template_status": "prototype",
          "view": "rear"
        }
      ]
    },
    "iphone-air": {
      "device_id": "iphone-air",
      "templates": [
        {
          "case_type": "hard",
          "production_publishable": false,
          "provenance": {
            "supplier_geometry": "none — not a production SKU template"
          },
          "renderable": true,
          "template_id": "iphone-air__hard__rear",
          "template_status": "prototype",
          "view": "rear"
        }
      ]
    }
  },
  "wallmock_commit": "92b196a1003183173ba340331349e2023e0ab120"
}
